current_source,current_usage,data_sample_insights,consolidation_target,mapping_complexity,transformation_type,key_fields_mapping,data_quality_concerns,migration_prerequisites,testing_approach,response_id,dashboard_id,data_quality_concerns_count,data_quality_concerns_text,migration_prerequisites_count,migration_prerequisites_text,key_fields_mapping_text
project_sales_raw.dataset_sales.sales_transactions,"This table is likely used as the primary source for transactional sales data, including revenue, date, customer, and product information.","N/A - Actual data not available. Would typically analyze schema, data types, primary keys, foreign keys, data volume, and typical value ranges for critical fields like 'Sales_Revenue', 'Transaction_Date', 'Customer_ID', 'Product_ID'.",finance_consolidated.fct_sales_transactions,6,major_restructure,"{'Transaction_ID': 'transaction_id', 'Transaction_Date': 'transaction_date_key', 'Customer_ID': 'customer_id', 'Product_ID': 'product_id', 'Sales_Revenue': 'sales_amount_usd', 'Currency_Code': 'currency_code'}","['Cannot determine specific data quality concerns without actual data. Potential concerns could include inconsistent date formats, missing customer/product IDs, duplicate transactions, or incorrect currency values.', ""Need to verify if 'Sales_Revenue' is gross or net, and if discounts/returns are handled consistently.""]","['Define and implement unified dimension tables (Dim_Customer, Dim_Product, Dim_Date, Dim_Currency).', 'Establish clear currency conversion rules and historical rates.', 'Identify and cleanse any duplicate records or inconsistent data entries in the source.']","Develop SQL queries to compare row counts, sum of key metrics (e.g., sales amount), and distinct counts of dimensions between the original source and the consolidated target for specific periods. Validate data types and nullability. (Cannot execute without actual data)",15,80ca81f3-0671-40ef-a0a9-825a1580ca1b,2,"Cannot determine specific data quality concerns without actual data. Potential concerns could include inconsistent date formats, missing customer/product IDs, duplicate transactions, or incorrect currency values., Need to verify if 'Sales_Revenue' is gross or net, and if discounts/returns are handled consistently.",3,"Define and implement unified dimension tables (Dim_Customer, Dim_Product, Dim_Date, Dim_Currency)., Establish clear currency conversion rules and historical rates., Identify and cleanse any duplicate records or inconsistent data entries in the source.","Transaction_ID->transaction_id, Transaction_Date->transaction_date_key, Customer_ID->customer_id, Product_ID->product_id, Sales_Revenue->sales_amount_usd, Currency_Code->currency_code"
project_sales_raw.dataset_sales.sales_targets,"This table likely stores sales targets by team, individual, product, or time period, used for performance tracking.","N/A - Actual data not available. Would typically analyze granularity (e.g., monthly, quarterly), target types (e.g., revenue, units), and linkage to sales teams/individuals.",finance_consolidated.fct_sales_targets,5,calculation_required,"{'Target_ID': 'target_id', 'Target_Period': 'target_date_key', 'Team_ID': 'team_id', 'Target_Amount': 'target_amount_usd'}","['Cannot determine specific data quality concerns without actual data. Potential concerns could include missing targets for certain periods/teams, inconsistent target setting methodologies, or misalignment of target granularity with actual sales data.']","['Standardize target definition and granularity across all sales teams/regions.', 'Ensure consistent mapping of sales teams/individuals to a unified dimension.']",Validate that all historical targets are correctly migrated and aggregated to the appropriate consolidated dimensions. Compare sum of targets for specific periods. (Cannot execute without actual data),15,80ca81f3-0671-40ef-a0a9-825a1580ca1b,1,"Cannot determine specific data quality concerns without actual data. Potential concerns could include missing targets for certain periods/teams, inconsistent target setting methodologies, or misalignment of target granularity with actual sales data.",2,"Standardize target definition and granularity across all sales teams/regions., Ensure consistent mapping of sales teams/individuals to a unified dimension.","Target_ID->target_id, Target_Period->target_date_key, Team_ID->team_id, Target_Amount->target_amount_usd"
Unknown (implied from dashboard context),"Provides transactional data for revenue movement analysis, including advertiser groups, revenue types, and portfolio parent groups.","Contains 2.85 million records, spanning 3 unique financial years, 4587 unique advertiser groups, 2 unique revenue types, and 35 unique portfolio parent groups. The presence of 'approx_unique_booking_line_ids' (126,348) suggests a detailed transactional grain. The 'movement_date' field containing future dates (2025-05-02 to 2025-07-02) is a critical anomaly.",finance.consolidated_revenue_fact,8,major_restructure,"{'movement_date': 'transaction_date (or booking_date/forecast_date, pending clarification)', 'unique_advertiser_groups': 'dim_advertiser.advertiser_group_name', 'unique_revenue_types': 'dim_revenue_type.revenue_type_name', 'unique_portfolio_parent_groups': 'dim_portfolio.portfolio_parent_group_name', 'approx_unique_booking_line_ids': 'fact_revenue.booking_line_id', 'total_records': 'fact_revenue.record_count', 'xtend_category_count': 'fact_revenue.revenue_category_xtend_count', 'programmatic_category_count': 'fact_revenue.revenue_category_programmatic_count', 'adpt_digital_category_count': 'fact_revenue.revenue_category_adpt_digital_count', 'sundry_category_count': 'fact_revenue.revenue_category_sundry_count', 'other_category_count': 'fact_revenue.revenue_category_other_count'}","[""The primary analysis SQL returned 'no_data', indicating a potential issue with the main data retrieval or metric calculation for the dashboard."", ""The 'movement_date' field contains future dates (2025), which is highly unusual for a 'Revenue Movement' dashboard and contradicts the 'freshness_test: PASS' result. This requires immediate investigation and clarification."", ""The actual source table name is not explicitly provided in the structure analysis, only 'source_table' as a column name, implying it's part of the metadata, not the actual table name.""]","[""Clarify the intended meaning and purpose of the 'movement_date' field and resolve the future date anomaly."", 'Identify the exact source table(s) and their schemas used by the dashboard.', 'Ensure primary keys and unique identifiers are well-defined for the transactional grain.', ""Resolve the 'no_data' issue from the primary analysis SQL to understand the core metrics.""]","Validate record counts, unique counts for dimensions (advertisers, revenue types, portfolios), and date ranges against the original source. Perform sum checks on key revenue amounts (once identified and accessible). Verify categorization logic for revenue types.",16,a1b901e6-c4fb-44bc-955a-3d7070c15829,3,"The primary analysis SQL returned 'no_data', indicating a potential issue with the main data retrieval or metric calculation for the dashboard., The 'movement_date' field contains future dates (2025), which is highly unusual for a 'Revenue Movement' dashboard and contradicts the 'freshness_test: PASS' result. This requires immediate investigation and clarification., The actual source table name is not explicitly provided in the structure analysis, only 'source_table' as a column name, implying it's part of the metadata, not the actual table name.",4,"Clarify the intended meaning and purpose of the 'movement_date' field and resolve the future date anomaly., Identify the exact source table(s) and their schemas used by the dashboard., Ensure primary keys and unique identifiers are well-defined for the transactional grain., Resolve the 'no_data' issue from the primary analysis SQL to understand the core metrics.","movement_date->transaction_date (or booking_date/forecast_date, pending clarification), unique_advertiser_groups->dim_advertiser.advertiser_group_name, unique_revenue_types->dim_revenue_type.revenue_type_name, unique_portfolio_parent_groups->dim_portfolio.portfolio_parent_group_name, approx_unique_booking_line_ids->fact_revenue.booking_line_id, total_records->fact_revenue.record_count, xtend_category_count->fact_revenue.revenue_category_xtend_count, programmatic_category_count->fact_revenue.revenue_category_programmatic_count, adpt_digital_category_count->fact_revenue.revenue_category_adpt_digital_count, sundry_category_count->fact_revenue.revenue_category_sundry_count, other_category_count->fact_revenue.revenue_category_other_count"
Unknown/Undetermined (dashboard returns no data),"Intended to provide financial transaction data for contra reporting, likely involving revenue, advertisers, and dates. However, the `total_records: 0` in the structure analysis indicates the dashboard is currently not pulling any data from its configured source.","The `structure_sql` shows `total_records: 0`, `unique_advertisers: 0`, `unique_adpoint_accounts: 0`, `unique_calendar_months: 0`, and `unique_sales_gms: 0`. This is a critical finding: the dashboard is effectively empty. No actual data structure or content can be inferred from the current state. The presence of columns like `source_table` and `table_name` in the schema suggests an underlying table, but its content is not accessible.",finance.consolidated_contra_revenue_fact,9,major_restructure,"{'advertiser': 'dim_advertiser.advertiser_name', 'date': 'dim_date.date_key', 'actual_amount': 'fact_contra_revenue.actual_amount', 'gross_revenue_amount': 'fact_contra_revenue.gross_revenue_amount', 'transaction_status': 'dim_transaction_status.status_name', 'financial_year': 'dim_date.fiscal_year', 'financial_month': 'dim_date.fiscal_month_name', 'account_number': 'dim_account.account_number'}","['No data returned from current source (`total_records: 0`).', 'Data freshness issues (`freshness_test: FAIL`).', 'Revenue positive test failed (`revenue_positive_test: FAIL`).', 'Unique accounts test failed (`unique_accounts_test: FAIL`).', 'Billed/booked status test failed (`billed_booked_status_test: FAIL`).', 'Business rules testing shows `records_tested: 0`, meaning rules are not being applied to any data.']","['Identify and fix the root cause of `total_records: 0` (e.g., incorrect BigQuery table path, permissions, or query logic).', 'Ensure the underlying source data system is operational and populated.', 'Establish data pipelines to populate the `finance.consolidated_contra_revenue_fact` table.', 'Validate data freshness and completeness in the new target table.']","Once the source data issue is resolved, perform a direct comparison of row counts and key metric sums between the original (now functional) dashboard and the new consolidated dashboard. Use a sample of historical data to verify transformations. Focus on validating the `freshness_test`, `revenue_positive_test`, `unique_accounts_test`, and `billed_booked_status_test` against the new data model.",17,b9dfd2f4-92fa-4f81-a5b1-17de880470f9,6,"No data returned from current source (`total_records: 0`)., Data freshness issues (`freshness_test: FAIL`)., Revenue positive test failed (`revenue_positive_test: FAIL`)., Unique accounts test failed (`unique_accounts_test: FAIL`)., Billed/booked status test failed (`billed_booked_status_test: FAIL`)., Business rules testing shows `records_tested: 0`, meaning rules are not being applied to any data.",4,"Identify and fix the root cause of `total_records: 0` (e.g., incorrect BigQuery table path, permissions, or query logic)., Ensure the underlying source data system is operational and populated., Establish data pipelines to populate the `finance.consolidated_contra_revenue_fact` table., Validate data freshness and completeness in the new target table.","advertiser->dim_advertiser.advertiser_name, date->dim_date.date_key, actual_amount->fact_contra_revenue.actual_amount, gross_revenue_amount->fact_contra_revenue.gross_revenue_amount, transaction_status->dim_transaction_status.status_name, financial_year->dim_date.fiscal_year, financial_month->dim_date.fiscal_month_name, account_number->dim_account.account_number"
Analysis Not Possible - No Actual Data,No actual data or SQL execution results were provided to identify current data sources or their usage within the dashboard.,No data samples available to reveal underlying data structure or quality concerns.,"Undefined without current source information. A consolidated finance data model would typically include tables for General Ledger, Transactions, Cost Centers, and Business Units.",10,major_restructure,{},"['Cannot identify specific data quality concerns (e.g., missing values, inconsistencies, format issues) without actual data from current sources.', ""The 'no_data' status for all SQL execution results prevents any assessment of data source quality or structure.""]","[""Full access to the dashboard's underlying data sources and schemas."", 'Successful execution of SQL queries to extract data samples and metadata.', 'Detailed documentation of current data models and relationships.']","Cannot define specific testing approaches without knowing the current data sources and their structure. General approach would involve data profiling, schema validation, and row count comparisons.",18,bb49fa78-5abe-4e68-a9c1-8172a832e724,2,"Cannot identify specific data quality concerns (e.g., missing values, inconsistencies, format issues) without actual data from current sources., The 'no_data' status for all SQL execution results prevents any assessment of data source quality or structure.",3,"Full access to the dashboard's underlying data sources and schemas., Successful execution of SQL queries to extract data samples and metadata., Detailed documentation of current data models and relationships.",
"Cannot determine due to 'no_data' from analysis queries. Typically, programmatic advertising data comes from ad platforms (e.g., Google Ads, DV360, The Trade Desk) or internal data warehouses.",Cannot determine specific usage without dashboard structure and data. Assumed to be for displaying rolling 60-day performance metrics.,No actual data available for analysis. The provided SQL execution results returned 'no_data'.,"Proposed target: `finance_consolidation.advertising_performance_daily` or similar, designed to unify programmatic advertising data from various sources.",8,major_restructure,{},"[""Fundamental concern: The analysis queries returned 'no_data', which means the current data source might be empty, misconfigured, or inaccessible. This needs immediate investigation."", 'Cannot assess specific data quality concerns (e.g., missing values, duplicates, incorrect types) without actual data.']","[""Investigate and resolve the 'no_data' issue for this dashboard's underlying data sources."", 'Identify the actual BigQuery tables/views currently powering this dashboard.', 'Understand the schema and data types of the current source tables.', 'Define the target consolidated data model for advertising performance data.']","Once data sources are identified and accessible, test data extraction, transformation, and loading (ETL) processes. Validate schema mapping and data type conversions. Perform row counts and aggregate sum comparisons against source data.",20,b15d856f-e3ce-4991-bf2a-92395390524f,2,"Fundamental concern: The analysis queries returned 'no_data', which means the current data source might be empty, misconfigured, or inaccessible. This needs immediate investigation., Cannot assess specific data quality concerns (e.g., missing values, duplicates, incorrect types) without actual data.",4,"Investigate and resolve the 'no_data' issue for this dashboard's underlying data sources., Identify the actual BigQuery tables/views currently powering this dashboard., Understand the schema and data types of the current source tables., Define the target consolidated data model for advertising performance data.",
project.dataset.ad_sales_fact_table_inferred,"This data source provides detailed ad sales transaction or booking data, serving as the foundation for the 'AdSales Data for Pacing Report'. It contains granular information such as financial year, week, revenue subtypes, and various dimensions (advertisers, publications, products). It's primarily used for current fiscal year (FY2025) pacing and performance tracking.","The source contains 5,820,463 records, exclusively for the financial year 2025, covering all 52 financial weeks. It tracks 5 unique revenue subtypes and has approximately 218 unique grain combinations, indicating a detailed level of data. The presence of columns like `unique_advertisers`, `unique_publication_codes`, `unique_product_groups`, and `unique_revenue_subtypes` suggests a rich dimensional context for the data.",unified_finance.sales.fct_ad_sales_revenue,7,major_restructure,"{'financial_year': 'dim_time.fiscal_year', 'financial_week': 'dim_time.fiscal_week_of_year', 'gross_revenue_amount': 'fct_ad_sales_revenue.gross_revenue_amount', 'revenue_subtype': 'dim_revenue_type.revenue_subtype_name', 'advertiser': 'dim_advertiser.advertiser_name', 'publication_code': 'dim_publication.publication_code', 'product_group': 'dim_product.product_group_name'}","[""The `primary_analysis_sql` returning 'no_data' is a critical concern, as it implies the primary data query for the dashboard is not functioning or returning expected results. This needs to be resolved before migration."", 'The `financial_week_exclusion_rule` has a 10.78% exclusion rate (627,347 records). The precise logic for this exclusion needs to be fully understood and accurately replicated in the new data model to ensure data consistency.', 'The existence of `null_gross_revenue_amount_count` and `null_net_revenue_count` columns suggests potential null values in key financial metrics. The actual counts of these nulls should be assessed, and a clear null-handling strategy (e.g., COALESCE to 0) must be defined for the target model.']","['Thoroughly document the exact business logic for all data exclusions and transformations applied to the current source data.', ""Resolve the 'no_data' issue identified in the `primary_analysis_sql` to ensure the core data is accessible and correctly interpreted."", 'Ensure all necessary dimensional data (e.g., advertisers, publications, products, revenue types) are available and conformed in the unified finance data model.', 'Define a clear strategy for handling historical data if the consolidated model needs to support more than just FY2025.']","Perform a comprehensive reconciliation of key aggregated metrics (e.g., total gross revenue, total pacing revenue) between the existing dashboard and the new `fct_ad_sales_revenue` table for FY2025. Validate the count of records that pass/fail the `financial_week_exclusion_rule` in the new model against the original dashboard's reported counts. Conduct row-level validation for a sample of excluded and included records.",24,3ee20092-1897-49b7-8bcd-4157d5f816eb,3,"The `primary_analysis_sql` returning 'no_data' is a critical concern, as it implies the primary data query for the dashboard is not functioning or returning expected results. This needs to be resolved before migration., The `financial_week_exclusion_rule` has a 10.78% exclusion rate (627,347 records). The precise logic for this exclusion needs to be fully understood and accurately replicated in the new data model to ensure data consistency., The existence of `null_gross_revenue_amount_count` and `null_net_revenue_count` columns suggests potential null values in key financial metrics. The actual counts of these nulls should be assessed, and a clear null-handling strategy (e.g., COALESCE to 0) must be defined for the target model.",4,"Thoroughly document the exact business logic for all data exclusions and transformations applied to the current source data., Resolve the 'no_data' issue identified in the `primary_analysis_sql` to ensure the core data is accessible and correctly interpreted., Ensure all necessary dimensional data (e.g., advertisers, publications, products, revenue types) are available and conformed in the unified finance data model., Define a clear strategy for handling historical data if the consolidated model needs to support more than just FY2025.","financial_year->dim_time.fiscal_year, financial_week->dim_time.fiscal_week_of_year, gross_revenue_amount->fct_ad_sales_revenue.gross_revenue_amount, revenue_subtype->dim_revenue_type.revenue_subtype_name, advertiser->dim_advertiser.advertiser_name, publication_code->dim_publication.publication_code, product_group->dim_product.product_group_name"
Implicit complex view/table (likely finance_data_view),"Provides a wide range of financial metrics (actuals, budget, forecast, revenue, spend), dimensional attributes (advertiser, masthead, product, sales segment), and scenario breakdowns. Used for high-level financial overview.","The `primary_analysis_sql` columns list over 100 fields, suggesting a highly denormalized or wide table/view. The `source_system_name` and `table_union_source` columns indicate data is aggregated from multiple underlying systems/tables. The `date_column_status: ""No date columns identified in provided queries""` is a critical insight, implying that date filtering might be hardcoded or managed at a higher level, which is problematic for flexible time-series analysis.","finance_transaction_fact, dim_date, dim_advertiser, dim_product, dim_scenario, dim_revenue_type, dim_sales_segment, dim_masthead",8,major_restructure,"{'Advertiser': 'dim_advertiser.advertiser_name', 'Major_Category': 'dim_product.major_category', 'Media_Network': 'dim_sales_segment.media_network', 'Category': 'dim_product.category', 'Sub_Category': 'dim_product.sub_category', 'portfolio_parent_group_name': 'dim_advertiser.portfolio_parent_group_name', 'fy_year': 'dim_date.fiscal_year', 'financial_month': 'dim_date.fiscal_month', 'fiscal_week_id': 'dim_date.fiscal_week_id', 'scenario_dimension': 'dim_scenario.scenario_type', 'total_actual_amount': 'finance_transaction_fact.actual_amount', 'total_estimate': 'finance_transaction_fact.estimate_amount', 'total_budget_amount': 'finance_transaction_fact.budget_amount', 'total_forecast_amount': 'finance_transaction_fact.forecast_amount', 'total_gross_revenue_amount': 'finance_transaction_fact.gross_revenue_amount', 'total_revenue_net': 'finance_transaction_fact.net_revenue_amount', 'revenue_type': 'dim_revenue_type.revenue_type_name', 'source_system_name': 'dim_source_system.source_system_name'}","[""Absence of explicit date columns in the dashboard's query, making time-series analysis and freshness validation difficult."", ""Inconsistent units for monetary values (e.g., '_k' suffix vs. no suffix)."", 'Many similar-sounding revenue/spend metrics requiring clear definitions and consolidation.', 'Complex embedded business rules (e.g., `records_not_divided_by_1000`, `digital_criteria`) that need to be externalized and standardized.']","['Define a comprehensive date dimension (dim_date) including fiscal and calendar periods.', 'Establish clear, standardized definitions for all financial metrics (revenue, spend, budget, forecast, pipeline, target).', 'Audit and standardize currency units for all monetary values.', 'Identify and map all source systems and their data granularity.', 'Document and translate all embedded business rules into a centralized transformation layer.']","Develop comprehensive regression tests comparing aggregated results from the new consolidated model against the original dashboard's totals for key metrics (e.g., total gross revenue, total budget, total forecast) across various dimensions (advertiser, financial year, masthead). Validate unit consistency. Use the `validation_sql` and `business_rules_sql` tests as a baseline for new validation queries.",26,52dd1ac1-19b5-4695-a7e6-632ef7a9dba3,4,"Absence of explicit date columns in the dashboard's query, making time-series analysis and freshness validation difficult., Inconsistent units for monetary values (e.g., '_k' suffix vs. no suffix)., Many similar-sounding revenue/spend metrics requiring clear definitions and consolidation., Complex embedded business rules (e.g., `records_not_divided_by_1000`, `digital_criteria`) that need to be externalized and standardized.",5,"Define a comprehensive date dimension (dim_date) including fiscal and calendar periods., Establish clear, standardized definitions for all financial metrics (revenue, spend, budget, forecast, pipeline, target)., Audit and standardize currency units for all monetary values., Identify and map all source systems and their data granularity., Document and translate all embedded business rules into a centralized transformation layer.","Advertiser->dim_advertiser.advertiser_name, Major_Category->dim_product.major_category, Media_Network->dim_sales_segment.media_network, Category->dim_product.category, Sub_Category->dim_product.sub_category, portfolio_parent_group_name->dim_advertiser.portfolio_parent_group_name, fy_year->dim_date.fiscal_year, financial_month->dim_date.fiscal_month, fiscal_week_id->dim_date.fiscal_week_id, scenario_dimension->dim_scenario.scenario_type, total_actual_amount->finance_transaction_fact.actual_amount, total_estimate->finance_transaction_fact.estimate_amount, total_budget_amount->finance_transaction_fact.budget_amount, total_forecast_amount->finance_transaction_fact.forecast_amount, total_gross_revenue_amount->finance_transaction_fact.gross_revenue_amount, total_revenue_net->finance_transaction_fact.net_revenue_amount, revenue_type->dim_revenue_type.revenue_type_name, source_system_name->dim_source_system.source_system_name"
